{"$schema":"https://json-schema.org/draft/2020-12/schema","title":"UU-AAP Observation Evidence to Core Outcome/Successor Binding v0.1","type":"object","required":["protocol","version","artifact_type","binding_id","bound_at","action_binding_ref","observation_evidence","core_outcome_receipt","core_successor_state_receipt","assertions","non_effects","content_hash"],"properties":{"protocol":{"const":"UU-AAP-OBSERVATION-CORE-SUCCESSOR-BINDING"},"version":{"const":"0.1"},"artifact_type":{"const":"ObservationCoreSuccessorBinding"},"binding_id":{"type":"string"},"bound_at":{"type":"string","format":"date-time"},"action_binding_ref":{"type":"object"},"observation_evidence":{"type":"object"},"core_outcome_receipt":{"type":"object"},"core_successor_state_receipt":{"type":"object"},"assertions":{"type":"object"},"non_effects":{"type":"object"},"content_hash":{"type":"string","pattern":"^sha256:[0-9a-f]{64}$"}}}