{"protocol":"UU-AAP-OBSERVATION-CORE-SUCCESSOR-BINDING","version":"0.1","artifact_type":"ObservationCoreSuccessorBinding","binding_id":"urn:uu-aap:observation-core-successor-binding:demo-001","bound_at":"2026-08-24T19:55:52Z","action_binding_ref":{"binding_id":"urn:uu-aap:invocation-action-receipt-binding:demo-001","content_hash":"sha256:fec21aae14d759854f6929d36635adb78f78ad0326361e2095da4b9e6815ee2f","core_action_receipt_hash":"sha256:c1c99311f8e8a45242bd48d4304f6c632a5e328b541686a474b6ff190d6a3f05"},"observation_evidence":{"evidence_type":"PostExecutionObservationEvidence","observed_at":"2026-08-24T19:55:50Z","observation_source":"provider_neutral_readback","predecessor_frontier":"git:demo/predecessor@aaaaaaaaaaaaaaaaaaaaaaaaaaaaaaaaaaaaaaaa","successor_frontier":"git:demo/successor@bbbbbbbbbbbbbbbbbbbbbbbbbbbbbbbbbbbbbbbb","target_binding_hash":"sha256:dc276f4263ae0bacd5f7ac1b5392898d17974ff231a894c4edd59fb4bb68b807","action_receipt_hash":"sha256:c1c99311f8e8a45242bd48d4304f6c632a5e328b541686a474b6ff190d6a3f05","independent_readback":true,"successor_state_observed":true,"expected_effect_observed":true,"causality_proven":false,"truth_certified":false,"liability_established":false,"content_hash":"sha256:aaaaaaaaaaaaaaaaaaaaaaaaaaaaaaaaaaaaaaaaaaaaaaaaaaaaaaaaaaaaaaaa"},"core_outcome_receipt":{"protocol":"UU-AAP Core","version":"0.1","receipt_type":"OutcomeReceipt","subject":{"id":"urn:uu-aap:capability:beta","scope":"operation:apply_change"},"frontier":{"revision":"git:demo/successor@bbbbbbbbbbbbbbbbbbbbbbbbbbbbbbbbbbbbbbbb","observed_at":"2026-08-24T19:55:50Z"},"predecessor_receipt_hashes":["sha256:c1c99311f8e8a45242bd48d4304f6c632a5e328b541686a474b6ff190d6a3f05"],"assertions":{"outcome_observed":true,"successor_revision_observed":"git:demo/successor@bbbbbbbbbbbbbbbbbbbbbbbbbbbbbbbbbbbbbbbb"},"non_effects":{"causality_proven":false,"universal_canonicality_established":false,"truth_certified":false,"liability_established":false},"issuer":{"id":"urn:uu-aap:test:observation-bridge","assurance":"self_declared_conformance_fixture"},"issued_at":"2026-08-24T19:55:50Z","payload":{"observation":"synthetic successor evidence observed","provenance_refs":["sha256:aaaaaaaaaaaaaaaaaaaaaaaaaaaaaaaaaaaaaaaaaaaaaaaaaaaaaaaaaaaaaaaa"]},"signature_profile":{"mode":"none","reason":"conformance_fixture_only"},"content_hash":"sha256:1fd02db01a64e4209ea2ad9631008ac432a6cfb883be39be099a211c10b6f026"},"core_successor_state_receipt":{"protocol":"UU-AAP Core","version":"0.1","receipt_type":"SuccessorStateReceipt","subject":{"id":"urn:uu-aap:capability:beta","scope":"operation:apply_change"},"frontier":{"revision":"git:demo/successor@bbbbbbbbbbbbbbbbbbbbbbbbbbbbbbbbbbbbbbbb","observed_at":"2026-08-24T19:55:51Z"},"predecessor_receipt_hashes":["sha256:1fd02db01a64e4209ea2ad9631008ac432a6cfb883be39be099a211c10b6f026"],"assertions":{"state_anchored":true,"successor_of":"sha256:c1c99311f8e8a45242bd48d4304f6c632a5e328b541686a474b6ff190d6a3f05"},"non_effects":{"intent_established":false,"authority_expanded":false,"liability_established":false,"truth_certified":false},"issuer":{"id":"urn:uu-aap:test:observation-bridge","assurance":"self_declared_conformance_fixture"},"issued_at":"2026-08-24T19:55:51Z","payload":{"evidence_refs":["sha256:aaaaaaaaaaaaaaaaaaaaaaaaaaaaaaaaaaaaaaaaaaaaaaaaaaaaaaaaaaaaaaaa"],"predecessor_state_receipt":"sha256:12b6eea5c9fdbd9d888c96da73c563301d500d2b36071a4ec968adaffd05f9bf"},"signature_profile":{"mode":"none","reason":"conformance_fixture_only"},"content_hash":"sha256:8edced4671e0ab3b52f67ed005c6ec38755152f70bbbbfcb28ce446cf6e6a0ba"},"assertions":{"action_receipt_exactly_bound":true,"observation_is_post_execution":true,"successor_frontier_observed":true,"outcome_core_identity_valid":true,"successor_core_identity_valid":true,"outcome_and_successor_share_frontier":true},"non_effects":{"execution_reperformed":false,"causality_proven":false,"universal_canonicality_established":false,"truth_certified":false,"liability_established":false,"authority_created_or_expanded":false,"future_action_permission_created":false},"content_hash":"sha256:03cbf7106e0ec527a2b8e91dd9b7dbc593180aeaeb32cd15cf259213953e092b"}